Date,City,State,Country,Shape,Duration,Comments
1/1/2010,benton,ar,us,circle,5 mins.,4 bright green circles high in the sky going in circles then one bright green light at my front door.
1/1/2010,bonita,ca,us,light,13 minutes,Three bright red lights witnessed floating stationary over San Diego New Years Day 2010
1/1/2010,el cajon,ca,us,triangle,6 minutes,On New Years Eve I went outside to hear the celebration and fireworks in my neighbor hood. And noticed 3 red lights above my house and
1/1/2010,el cajon,ca,us,triangle,12 minutes,3 Red objects hovering over El Cajon CA
1/1/2010,fresno,ca,us,light,1 min,Fresno cal. bright light hovers over head then vanished
1/1/2010,grants pass,or,us,triangle,a few mintues,Triangle shaped craft with three red lights at points hovering over Grants Pass&#44 Oregon.
1/1/2010,la mesa,ca,us,light,10 min,Three red lights over southern California that made a triangle shape
1/1/2010,lemon grove,ca,us,light,about 15 minutes,3 Red lights in line pattern above El Cajon/ East County.
1/1/2010,maricopa,az,us,unknown,3 minutes,One huge UFO or three seperate ones
1/1/2010,park city,ky,us,light,2-3 seconds,Lights orbiting the moon
1/1/2010,st. louis,mo,us,fireball,1 min,7 floating orbs or fireballs moving from southwest to northeast direction.
1/1/2010,el cajon,ca,us,formation,15 min.,Three red lights over the San Diego area - IT&#39S A HOAX YET AGAIN&#33&#33
1/1/2010,spring valley,ca,us,light,10:00,Three bright red lights in a straight line formation
1/1/2010,willow,ak,us,formation,7 min,four orange red objects suddenly appear 12:01 am new years move north then south and dissapear
1/1/2010,antioch,ca,us,other,30 minuets,Objects in sky over Antioch California 12:03AM January 1&#44 2010
1/1/2010,el cajon,ca,us,light,10min,3 red lights in sky new years 2010
1/1/2010,naples,fl,us,sphere,2 min,i&#39m in naples park. last night&#44 my husband and I were sitting outside --neighbors lighting off fireworks&#44 etc. We&#39re under a lanai and
1/1/2010,la mesa,ca,us,triangle,4-6 minutes,3 bright red lights hovering high in the sky in an elongated triangle pattern just after midnight 2010 in La Mesa&#44 Ca
1/1/2010,anchorage,ak,us,light,one minute,Upper atmosphere object moving south&#44 becoming stationary and later moving east at a high rate of speed.
1/1/2010,national city,ca,us,formation,25 mintutes,3 red lights over the mountains in Eastern San Diego
1/1/2010,boca raton,fl,us,fireball,4 minutes,Slow moving fireball northbound at hight altitude Southern Florida
1/1/2010,falcon,co,us,disk,8 mins,We experienced red disk over the falcon&#44 colorado sky within the first minutes of the new year.
1/1/2010,crestview,fl,us,unknown,2 minutes,Orange/Yellow flickering light in the sky with no sound and abrupt changes in direction&#44 below 12&#44000 feet.
1/1/2010,aspen,co,us,chevron,2 mins,New Years Eve Anomoly In Aspen Colorado
1/1/2010,walworth,wi,us,sphere,5-7 minutes,Large red/orange orb traveling southeast between Milwaukee and Chicago.
1/1/2010,baker,fl,us,unknown,15,Six flickering orange lights over baker
1/1/2010,san diego,ca,us,sphere,20 minutes,Orange spheres in sky New Year&#39s Eve&#44 San Diego&#44 CA
1/1/2010,willow,ak,us,sphere,10-11 min,4 redishorange shpereiodical objects appear during 2010 fireworks show hover around then disappear 500 Lights On Object0: Yes
1/1/2010,san diego,ca,us,triangle,3 minutes,It happen nEw years eve 2010
1/1/2010,haverhill,ma,us,triangle,30 seconds,Haverhill Massachusetts triangle object sighting
1/1/2010,pasadena,ca,us,triangle,1 minute,Walking on Cordova westbound just before the Hilton. Sun was setting so looked up to see if we could see any satellite reflection. Sa
1/1/2010,albuquerque,nm,us,light,half an hour,My wife and I were outside in the Jacuzzi when she first saw a light. It glowed and traveled from north to south. It lit up again whe
1/1/2010,jasper,fl,us,sphere,1 min,Bright light sets in the eastren sky.
1/1/2010,bakersfield,ca,us,light,1 minute,Two Crafts dancing in the sky&#33
1/2/2010,orange,ca,us,light,5-6 minutes,Point of light in daytime sky over Orange&#44 CA
1/2/2010,phoenix,az,us,rectangle,10 seconds,A bright light in Phoenix hovered above houses in broad daylight&#44 then vanished
1/2/2010,sacramento,ca,us,triangle,4min,Triangle shaped object spotted over Sacramento River.
1/2/2010,middleburg,fl,us,sphere,10 minutes,I was on my way out the door of my house &#44 when i stepped into the drive way of my house i noticed a redish/orange moon it was straight
1/2/2010,waxhaw,nc,us,sphere,1 minute,red glow/flame over waxhaw&#44 nc
1/2/2010,madison,al,us,triangle,2 minutes,Triangle shaped craft with orange-yellow lights that hovered very low near Redstone Arsenal in Madison&#44 Al
1/2/2010,loveland,co,us,cross,5 minutes,extremely bright light over tree in loveland&#44 CO
1/2/2010,atlanta,ga,us,fireball,3 seconds,glowing red spaceship flys at car
1/3/2010,mason,oh,us,circle,20 mins,didnt move like a plane or helicopter&#44 too close to be a star.
1/4/2010,glen spey,ny,us,flash,35 mins,colorful flashing craft hovers for 30mins &amp; then flashes violet&#44 followed by dashing to the right &amp; disappearing
1/4/2010,reedville,va,us,changing,abt 1 hour,Spherical flashing lights&#44 hovering in the northwestern sky&#44 no sound. ((NUFORC Note: Possible sighting of celestial body?? PD))
1/4/2010,cleveland,oh,us,triangle,downtown,is it a ufo
1/4/2010,whittier,ca,us,light,3 seconds,Thick bright light travels across southern California then disappears?
1/4/2010,ben wheeler,tx,us,light,2-3 minutes,Very bright light&#44 flying lower than a jet; appeared to be tracking another light. ((NUFORC Note: Satellites?? PD))
1/4/2010,san pablo,ca,us,unknown,4 hours,Extremely high&#44 hovering object blinking various colors with red light on top seen from San Pablo. ((NUFORC Note: Sirius?? PD))
1/4/2010,cedar rapids,ia,us,light,15 min,Two very bright white lights come close together in the northwest sky and one dissapears...
1/4/2010,el cajon,ca,us,light,noticed from dusk to dawn,&quot;Fake stars&quot; over San Diego&#44 CA
1/5/2010,princeton,in,us,disk,15 seconds,Flying Saucer hovering above ground.
1/5/2010,chula vista,ca,us,oval,10 seconds,One Oval Spining above Chula Vista
1/5/2010,colonia,nj,us,unknown,15 min,loud aircraft that could be heard for up to 15 minutes at its lowest rummble.
1/5/2010,clinton,nj,us,cigar,3 weeks,Traveling to Pennylvania.
1/5/2010,new paltz,ny,us,triangle,45 seconds,Black Triangular Aircraft w/ Three White Lights Flying Low in New Paltz&#44 NY
1/5/2010,rockwell,nc,us,cigar,40 seconds,Brilliant silver/white silent object flew into sight&#44 slowed&#44 paused then faded from sight.
1/5/2010,anderson,sc,us,light,seven minutes,Orange light that set down in woods&#44 got brighter&#44 then left
1/6/2010,san diego,ca,us,light,20 minutes,Unusual silent&#44 orange glowing light stopping changing direction and discharging sudstance.
1/6/2010,pacific palisades,ca,us,teardrop,5 minutes,I was at home in my condo at night.My condo faces the back of the 16 unit building.
1/6/2010,searcy,ar,us,disk,1 hour,disc shape hovering above Searcy&#44 AR
1/7/2010,southampton,ny,us,formation,30 sec,7 dim lights triangular formation 30 sec easterly direction off long island ny
1/7/2010,mansfield,ma,us,light,3 min,Bright lights aligned with Castor and Pollux
1/7/2010,edgartown,ma,us,circle,50 sec.,UFO Sighting 01/07/12010 My wife and I were sitting in our hot tub when we saw it. It was almost overhead traveling from west to eas
1/7/2010,windham,nh,us,light,2 seconds,Bright white flash on the southwestern horizon
1/7/2010,west boylston,ma,us,light,approx. 1 sec.,Bright Florissant-green&#44 circular light arching downward with a trail of the same color. ((NUFORC Note: Possible meteor? PD))
1/7/2010,westbrook,ct,us,triangle,2-3 minutes,Very large (747ish)&#44 low flying&#44 slow moving (30-50 mph)&#44 and absolutely silent triangular object w/3 lights.
1/8/2010,fort worth,tx,us,chevron,20 minutes,Colorful and bright huge objects in sky.
1/8/2010,tomball,tx,us,unknown,10-15 seconds,Four straight &#44horizontal lights on one 40-60&#39 structure&#44 150-200 ft in the air just above the tree line (Tomball TX)
1/8/2010,port saint lucie,fl,us,fireball,2 -3 minutes,Red ball surrounded by fire surrounded by a blue green circle over Port Saint Lucie Florida
1/8/2010,boulder,co,us,triangle,40 seconds,A trangular craft with several&#44 large&#44 bright lights flew low and quick over the neighborhood
1/9/2010,london (canada),on,ca,disk,10-20 mins,very close encounter with what i truley cant imagine
1/9/2010,cleveland,tn,us,other,unknown,my daughter went with her mother to look for a job&#44 at hickery springs mfco.she toke a picture of her self seting in the drivers set. a
1/9/2010,francis creek,wi,us,light,1 hour,multi-colored pulsating UFO&#44 round white object falls out of it straight down toward the ground
1/9/2010,woodbridge,nj,us,light,nine minutes,Saw two lights that were not planes.
1/9/2010,seattle,wa,us,cylinder,1 minute,Reviewing my photos I came across a suspicious object in the upper right corner and it way flying at an odd angle. Too steep for a plan
1/9/2010,freedom (watsonville),ca,us,triangle,20,((HOAX??)) 1/9/19 DURATION 20:00 FREEDOM CA IT WAS A TRIANGLE BUT FIRST IT WAS ONE LIGHT
1/9/2010,santa fe springs,ca,us,sphere,6 seconds,Sphere like glowing objects hovering and then traveling in an incredibly fast speed then vanishing.
1/9/2010,saline,mi,us,formation,several hours,Southeast sky early in the evening&#44 Blue&#44 Green and Red Lights. ((NUFORC Note: Possible sighting of Sirius?? PD))
1/9/2010,buffalo,ny,us,light,2 seconds,Fast moving light curves in sky
1/9/2010,cincinnati,oh,us,light,not sure,cinti&#44ohio 23:00 light in back yard
1/9/2010,paducah,ky,us,unknown,45 minutes,I went outside for nightly smoke break and to gaze at the night sky. I noticed something that seemed like an out of place star only to
1/10/2010,uxbridge,ma,us,sphere,5 minutes,Unidentified object&#44 roughly spherical&#44 hovering/moving very slowly&#44 many lights&#44 multiple colors.
1/10/2010,round rock,tx,us,light,2 seconds,3 Fast-moving lights over Round Rock Texas
1/10/2010,san jacinto,ca,us,unknown,5 secondes,A bright light hitting us while leaving at high speed
1/10/2010,norton,ma,us,triangle,1 min,strange craft with amazing speed.
1/10/2010,hancock,md,us,sphere,2 minutes,Photo taken of silver colored sphere in Western Maryland.
1/10/2010,cary,nc,us,changing,15 min,Object appears and hovers&#44 strange maneuvering.
1/10/2010,tularosa,nm,us,other,5 min.,green figure 8 followed by military aircraft
1/10/2010,eunice,la,us,oval,15:00 mins,Two objects meet then leave each other one to the east and one to the west
1/10/2010,butler,mo,us,chevron,1-2 minutes,((HOAX??)) I was heading driving to the store when I seen a red and yellow lighted craft in the air flying 1000 ft or less strobing.
1/10/2010,lompoc,ca,us,fireball,6 sec,huge bright orange sphere appeared and dissapeared
1/10/2010,pratt,ks,us,circle,6 seconds,4 rings of light accompanied by a single ring of light
1/11/2010,taunton,ma,us,unknown,10 seconds,((HOAX??)) saw a strange object in the night sky
1/11/2010,lakeland,fl,us,other,1 minute,Neon blue light in the sky disappears and then phone call is interrupted by unknown sound .
1/11/2010,fort myers,fl,us,fireball,15 seconds,Bright fireball seen over Naples area of SW Florida.
1/11/2010,fairfield,ca,us,oval,unknown,Shape was black in color
1/11/2010,joplin,mo,us,triangle,5 to 10 sec.,V shaped&#44 extreamly fast&#44 silent and the color was orange.
1/11/2010,leatherwood,ky,us,other,5 minutes,3 SQUARE-SHAPED OBJECTS WITH RED LIGHTS IN A TRIANGULAR FORM - KENTUCKY
1/11/2010,ingleside (canada),on,ca,triangle,5 minutes,triangle shaped craft with four coloured lights
1/12/2010,fayetteville,wv,us,sphere,7 minuts,something followed my family and left a piece behind
1/12/2010,eugene,or,us,unknown,2 minutes,Awaken by several episodes of BRIGHT FLASHING LIGHT and a very LOUD mysterous noise.
1/12/2010,springfield,or,us,changing,3 minutes,black floating object with lights
1/12/2010,alma,ar,us,other,night,((HOAX??)) a strange ball of fire&#44 like after burners.
1/12/2010,wichita,ks,us,teardrop,5 minutes,Orange teardrop-shape craft
1/12/2010,deep run,nc,us,other,10 seconds,Car like object in the sky
1/12/2010,waukesha,wi,us,disk,15minutes,five glowning globes over waukesha&#44wi
1/12/2010,ceres,ca,us,fireball,30 seconds,Fireballs seen from Ceres&#44 California
1/13/2010,white oak,pa,us,triangle,30 seconds,Blinking lights on a rectanglar shaped object spotted in the sky in White Oak&#44 PA.
1/13/2010,ackerman,ms,us,light,2 hours,A bright light hovering in the southwestern sky. ((NUFORC Note: Possible sighting of Sirius. PD))
1/13/2010,gulf breeze,fl,us,unknown,4 minutes,Bright orange object&#44 rapid speed and direction changes ..